{
  "iso3": "EST",
  "country": "Estonia",
  "last_reviewed": "2026-07-19",
  "answers": {
    "digital_id": {
      "value": "yes",
      "note": "Estonia's mandatory chip-based e-ID card has been required for all citizens/residents since 2002 (99% coverage) and is used for authentication, legally binding digital signatures (equivalent to handwritten signatures under eIDAS), and access to virtually all e-government and banking services via the X-Road data-exchange layer (about 2.2 billion transactions/year across 52,000+ organizations). Architecture is decentralized/citizen-controlled: identity credentials and two cryptographic key pairs reside on the citizen's own PIN-protected chip rather than a single central database queried at each transaction, and X-Road itself is a distributed exchange layer connecting separate databases rather than one central repository.",
      "sources": [
        {"url": "https://www.id.ee/en/rubriik/e-estonia/", "title": "e-Estonia | ID.ee", "accessed": "2026-07-19"},
        {"url": "https://digitalgov.network/xroad-dxp/", "title": "Estonia's X-Road: The Decentralized Digital Backbone of a Paperless Nation | Digital Government Network", "accessed": "2026-07-19"}
      ]
    },
    "cash_payment": {
      "value": "yes",
      "note": "The euro has been Estonia's sole legal tender since January 1, 2011, and cash remains fully legal and in circulation. Eesti Pank (the central bank) actively guarantees continued cash availability and exchanges old Estonian kroon banknotes/coins for euros indefinitely; no restrictions on ordinary cash payments were found.",
      "sources": [
        {"url": "https://www.eestipank.ee/en/cash", "title": "Cash | Eesti Pank", "accessed": "2026-07-19"},
        {"url": "https://www.eestipank.ee/en/museum/eesti-pank-guarantees-existence-cash", "title": "Eesti Pank guarantees the existence of cash | Eesti Pank", "accessed": "2026-07-19"}
      ]
    },
    "mandatory_schooling": {
      "value": "partial",
      "note": "School attendance is compulsory (ages 7–17), but homeschooling is legal and regulated under the Education Act: parental-choice homeschooling is permitted only up to age 12 (parent-managed and parent-financed), while medical-necessity homeschooling can continue through age 17 (state-funded, school-managed); both require annual school approval and at least twice-yearly assessment against the curriculum. A May 2026 amendment (Amendment Paper 583) grants the government broad new regulation-making power over homeschooling conditions, passed without consultation with homeschooling families; detailed regulations are still to be drafted.",
      "sources": [
        {"url": "https://hslda.org/post/estonia", "title": "Estonia | HSLDA", "accessed": "2026-07-19"},
        {"url": "https://www.starpathlearning.com/homeschool-requirements/estonia", "title": "Estonia Home Education Requirements 2026 | Starpath Learning", "accessed": "2026-07-19"}
      ]
    },
    "social_credit": {
      "value": "no",
      "note": "No government social-credit system exists. Private credit bureaus such as Creditinfo Eesti provide financial creditworthiness scores (the probability a person will fail to pay invoices) only, unrelated to any state-run citizen trustworthiness score.",
      "sources": [
        {"url": "https://creditinfo.ee/en/avoid-debts/ratings/score/", "title": "Credit Score on Private Person | Creditinfo Eesti", "accessed": "2026-07-19"}
      ]
    },
    "alt_currency": {
      "value": "yes",
      "note": "Cryptocurrency ownership and trading are legal. From July 1, 2026, crypto-asset service providers must hold a license from Finantsinspektsioon (or another EU regulator) under the EU's MiCA regulation and Estonia's Crypto Asset Market Act — legacy VASP licenses issued under the older AML regime become invalid after that date. No restrictions on gold or precious-metals ownership were found.",
      "sources": [
        {"url": "https://globallawexperts.com/crypto-license-estonia/", "title": "Estonia Crypto Licensing 2026, Updated AML, VASP Rules | Global Law Experts", "accessed": "2026-07-19"}
      ]
    },
    "mandatory_insurance": {
      "value": "yes",
      "note": "Health insurance is compulsory and solidarity-funded through the Estonian Health Insurance Fund (EHIF/Tervisekassa), financed mainly by a 13% payroll social tax paid by employers. Coverage reaches about 95% of the population; the remainder is still covered for emergency care regardless of insurance status.",
      "sources": [
        {"url": "https://tervisekassa.ee/en/people/health-insurance", "title": "Health insurance | Tervisekassa (Estonian Health Insurance Fund)", "accessed": "2026-07-19"}
      ]
    },
    "travel_restrictions": {
      "value": "partial",
      "note": "Domestic and EU/Schengen freedom of movement is unrestricted for Estonian residents generally, but Estonia has tightened its Russian border: short-term Schengen-visa tourism/leisure entry by Russian citizens has been banned since September 19, 2022 (with exceptions for close family), the disputed 'Saatse Boot' area was closed in 2025 after armed Russian soldiers were sighted there, and the Koidula and Luhamaa border crossings have been closed nightly (19:00–07:00) since February 24, 2026, for security reasons.",
      "sources": [
        {"url": "https://vm.ee/en/consular-visa-and-travel-information/visa-information/restrictions-accepting-visa-applications", "title": "Restrictions on accepting visa applications for Russian and Belarusian citizens | Välisministeerium (Estonian Ministry of Foreign Affairs)", "accessed": "2026-07-19"},
        {"url": "https://www.politsei.ee/en/procedure-for-crossing-the-estonian-russian-border", "title": "Procedure for crossing the Estonian-Russian border | Politsei (Estonian Police and Border Guard)", "accessed": "2026-07-19"}
      ]
    },
    "internet_restrictions": {
      "value": "partial",
      "note": "General internet access is open, and Estonia scores highly on internet-freedom assessments, but under EU sanctions related to Russia's invasion of Ukraine, Estonia blocks access to Russian state-affiliated broadcasters and has gone further than the EU's own list — as of 2024 the Consumer Protection and Technical Regulatory Authority (TTJA) was blocking roughly 307 websites and 53 TV channels (e.g., Ntv.ru, Ren.tv, 1tv.com, Lenta.ru, Tass.ru).",
      "sources": [
        {"url": "https://bnn-news.com/estonia-bans-access-to-russian-state-media-online-233195", "title": "Estonia bans access to Russian state media online | Baltic News Network", "accessed": "2026-07-19"},
        {"url": "https://freedomhouse.org/country/estonia/freedom-net/2024", "title": "Estonia: Freedom on the Net 2024 Country Report | Freedom House", "accessed": "2026-07-19"}
      ]
    },
    "free_speech": {
      "value": "yes",
      "note": "Estonia ranks 3rd of 180 countries in RSF's 2026 World Press Freedom Index, behind only Norway and the Netherlands, retaining a 'good' rating despite dropping from 2nd place. Media are independent, though RSF flags growing political pressure on the public broadcaster ERR, a media market concentrated among a few groups (Postimees, Ekspress, ERR), and rising online harassment of journalists as practical challenges.",
      "sources": [
        {"url": "https://estonianworld.com/life/estonia-ranks-third-in-2026-world-press-freedom-index/", "title": "Estonia ranks third in 2026 World Press Freedom Index | Estonian World", "accessed": "2026-07-19"},
        {"url": "https://rsf.org/en/country/estonia", "title": "Estonia | RSF", "accessed": "2026-07-19"}
      ]
    }
  }
}
