{
  "iso3": "DEU",
  "country": "Germany",
  "last_reviewed": "2026-07-19",
  "answers": {
    "digital_id": {
      "value": "partial",
      "note": "The national ID card (Personalausweis) is legally mandatory for citizens aged 16+, and as of 2026 all newly issued cards ship with the eID online-authentication function pre-activated by default (previously opt-in), enabling contract signing and bank-account opening via the AusweisApp. The eID uses a citizen-held cryptographic chip (two key pairs, a 6-digit PIN) rather than a centralized government database query at time of use — a decentralized, citizen-controlled design — but active adoption of the online eID for everyday services still lags behind Estonia's, and by end of 2026 Germany must additionally roll out the EU-wide EUDI wallet.",
      "sources": [
        {"url": "https://www.personalausweisportal.de/Webs/PA/EN/government/offering-electronic-identification/offering-electronic-identification-node.html", "title": "Offering electronic identification | Personalausweisportal", "accessed": "2026-07-19"},
        {"url": "https://www.germany.info/us-en/service/02-passportsandidcards/id-card-important-information-917866", "title": "Important Information on the new electronic German ID Card | Federal Foreign Office", "accessed": "2026-07-19"}
      ]
    },
    "cash_payment": {
      "value": "yes",
      "note": "Cash remains legal tender with no current general German cap on cash payments. A new EU-wide anti-money-laundering regulation (EU 2024/1624) will impose a €10,000 cap on cash payments accepted by businesses (private person-to-person deals excluded) starting 10 July 2027 — a future restriction, not yet in force as of mid-2026.",
      "sources": [
        {"url": "https://cryptobriefing.com/eu-impose-10-000-euros-cash-cap-july-2027-new-aml-regulation/", "title": "EU to impose €10,000 cash payment limit from July 2027 under new AML regulation", "accessed": "2026-07-19"},
        {"url": "https://www.bundesbank.de/en/tasks/cash-management/euro-coins/legal-framework-623726", "title": "Legal framework | Deutsche Bundesbank", "accessed": "2026-07-19"}
      ]
    },
    "mandatory_schooling": {
      "value": "yes",
      "note": "Germany enforces compulsory school attendance (Schulpflicht, not merely compulsory education) and does not permit homeschooling for pedagogical or religious reasons — only rare, narrow medical exceptions apply. This traces to the 1938 Reichsschulpflichtgesetz and has been repeatedly upheld by German courts and the European Court of Human Rights; violations can escalate from fines to short custody removals.",
      "sources": [
        {"url": "https://hslda.org/post/germany", "title": "Germany | HSLDA", "accessed": "2026-07-19"}
      ]
    },
    "social_credit": {
      "value": "no",
      "note": "No government social-credit system exists. SCHUFA, Germany's dominant credit bureau, is a private company (majority-owned by banks and retailers) that scores financial payment reliability only, not a state-run trustworthiness score; since March 17, 2026 it uses a unified 100–999 point scale.",
      "sources": [
        {"url": "https://legal.pwc.de/en/news/articles/the-2026-schufa-score-reforms-and-implications-for-financial-services-firms", "title": "The 2026 SCHUFA score reforms and implications for financial services firms | PwC Legal", "accessed": "2026-07-19"}
      ]
    },
    "alt_currency": {
      "value": "yes",
      "note": "Individuals may freely buy, hold, and self-custody cryptocurrency; the government has stated it does not intend to ban crypto ownership. Crypto-asset service providers require BaFin authorization under the EU's MiCA regulation (implemented via the Kryptomärkteaufsichtsgesetz, KMAG) as of December 30, 2024. No restrictions were found on private gold ownership or trade.",
      "sources": [
        {"url": "https://www.nortonrosefulbright.com/en/knowledge/publications/5ee1e37e/new-regulatory-regime-for-crypto-assets-in-germany", "title": "New regulatory regime for crypto assets in Germany | Norton Rose Fulbright", "accessed": "2026-07-19"}
      ]
    },
    "mandatory_insurance": {
      "value": "yes",
      "note": "Health insurance has been compulsory for the entire resident population since 2009, split between statutory insurance (GKV, ~90% of residents, mandatory for employees earning under roughly €64,350/year) and private insurance (PKV) for those above that threshold or self-employed; under 0.1% of the population is uninsured according to the Federal Statistical Office (Destatis).",
      "sources": [
        {"url": "https://www.commonwealthfund.org/international-health-policy-center/countries/germany", "title": "Germany | Commonwealth Fund", "accessed": "2026-07-19"}
      ]
    },
    "travel_restrictions": {
      "value": "partial",
      "note": "General freedom of movement is respected for residents domestically and across Schengen, though Germany is among 11 Schengen states that reintroduced internal border controls in 2026 citing security and migration pressure. Separately, a CEAS Adjustment Act (GEAS-Anpassungsgesetz) passed by the Bundestag on 27 February 2026 (in force from June 2026) allows authorities to bar asylum seekers and refugees from leaving reception and 'secondary migration' centers for extended periods based on a presumption of flight risk — a restriction on a specific group, not the general population.",
      "sources": [
        {"url": "https://asylumineurope.org/reports/country/germany/reception-conditions/access-and-forms-reception-conditions/freedom-movement/", "title": "Freedom of movement | Asylum Information Database (AIDA), European Council on Refugees and Exiles", "accessed": "2026-07-19"},
        {"url": "https://www.bundesregierung.de/breg-en/news/migration-ceas-2427060", "title": "Germany implements Common European Asylum System | Federal Government (Bundesregierung)", "accessed": "2026-07-19"}
      ]
    },
    "internet_restrictions": {
      "value": "partial",
      "note": "There is no general blocking of the open internet, but the Network Enforcement Act (NetzDG, 2018) requires platforms with 2M+ registered users to investigate and remove flagged illegal content quickly under threat of large fines, and since March 2021 an ISP-industry body (CUII) has DNS-blocked 'structurally copyright-infringing' websites. Freedom House rated Germany among the freer countries for internet access (8th of 70 rated countries in its 2022 Freedom on the Net report) while flagging controversial over-removals and rising self-censorship concerns.",
      "sources": [
        {"url": "https://freedomhouse.org/country/germany/freedom-net/2024", "title": "Germany: Freedom on the Net 2024 Country Report | Freedom House", "accessed": "2026-07-19"}
      ]
    },
    "free_speech": {
      "value": "partial",
      "note": "Article 5 of the Basic Law (Grundgesetz) guarantees freedom of expression, but it is legally bounded by hate-speech law (Volksverhetzung, §130 StGB, covering incitement against segments of the population) and by §188 StGB, which criminalizes defamation/malicious statements against politicians — investigations under §188 rose from about 1,400 in 2022 to 4,792 in 2025, prompting 2026 reform proposals. RSF also flags rising political polarization, disinformation, and pressure on journalists as growing threats to press freedom.",
      "sources": [
        {"url": "https://rsf.org/en/press-freedom-under-pressure-germany-due-disinformation-political-polarisation-and-attacks", "title": "Press freedom under pressure in Germany due to disinformation, political polarisation and attacks on journalism | RSF", "accessed": "2026-07-19"},
        {"url": "https://www.tatsachen-ueber-deutschland.de/en/politik-deutschland/meinungsfreiheit-pressefreiheit-in-deutschland", "title": "Freedom of expression in Germany: provocation is permitted, hate speech is not | Tatsachen über Deutschland (German Federal Government)", "accessed": "2026-07-19"}
      ]
    }
  }
}
